{
  "$schema": "https://json-schema.org/draft/2020-12/schema",
  "$id": "ldls/tree.schema.json",
  "title": "LDLS structured document",
  "description": "A document split into a tree of nodes. Each node is decoded with its own sequence ID; see schema/SCHEMA.md for the invariants and merge rules.",
  "type": "object",
  "required": ["schema_version", "domain", "source", "nodes"],
  "properties": {
    "schema_version": { "const": 1 },
    "domain": { "type": "string", "description": "Parser domain, e.g. markdown, html, json." },
    "source": { "type": "string", "description": "Name of the input document." },
    "model": { "type": "string", "description": "GGUF model whose tokenizer produced the token IDs." },
    "merge": {
      "type": "object",
      "description": "Parameters of the small-subtree merge rules actually applied.",
      "properties": {
        "min_leaf_tokens": { "type": "integer", "minimum": 1 },
        "max_nodes": { "type": "integer", "minimum": 1 },
        "nodes_before_merge": { "type": "integer", "minimum": 1 }
      }
    },
    "n_tokens": { "type": "integer", "description": "Total tokens over all nodes (each stored once in the KV cache)." },
    "nodes": {
      "type": "array",
      "minItems": 1,
      "description": "Nodes in pre-order. nodes[0] is the root. A node's id equals its index.",
      "items": { "$ref": "#/$defs/node" }
    }
  },
  "$defs": {
    "node": {
      "type": "object",
      "required": ["id", "parent", "node_type", "tokens", "positions", "seq_ids"],
      "properties": {
        "id": { "type": "integer", "minimum": 0 },
        "parent": {
          "type": ["integer", "null"],
          "description": "Id of the parent node; null only for the root. Always smaller than id (pre-order)."
        },
        "node_type": {
          "type": "string",
          "description": "Structural type. Markdown uses: document, section, paragraph, list, code, table, blockquote, html, rule, merged."
        },
        "title": { "type": "string", "description": "Human-readable label used to address the node (e.g. the heading text)." },
        "tokens": {
          "type": "array",
          "minItems": 1,
          "items": { "type": "integer", "minimum": 0 },
          "description": "Token IDs of this node's own text (not its children)."
        },
        "positions": {
          "type": "array",
          "minItems": 1,
          "items": { "type": "integer", "minimum": 0 },
          "description": "One position per token. Tree positions: consecutive, starting at the parent's last position + 1 (0 for the root). Sibling subtrees overlap."
        },
        "seq_ids": {
          "type": "array",
          "minItems": 1,
          "items": { "type": "integer", "minimum": 0 },
          "description": "Sequence IDs every token of this node is tagged with: the node's own sequence first, then the sequences of all its descendants."
        },
        "n_markup": { "type": "integer", "minimum": 0, "description": "Tokens of this node that are pure markup/syntax or whitespace." },
        "text": { "type": "string", "description": "Source text of the node (for debugging; the driver uses tokens)." }
      }
    }
  }
}
