{
 "schema_version": 1,
 "domain": "json",
 "source": "movie_db.json",
 "model": "Llama-3.2-1B-Instruct-Q4_K_M.gguf",
 "merge": {
  "min_leaf_tokens": 48,
  "max_nodes": 48,
  "nodes_before_merge": 35
 },
 "n_tokens": 209,
 "nodes": [
  {
   "id": 0,
   "parent": null,
   "node_type": "document",
   "title": "(document)",
   "seq_ids": [
    0,
    1,
    2,
    3,
    4,
    5,
    6,
    7,
    8
   ],
   "positions": [
    0,
    1,
    2,
    3,
    4,
    5,
    6,
    7,
    8,
    9,
    10,
    11,
    12,
    13,
    14,
    15,
    16,
    17,
    18,
    19,
    20,
    21,
    22,
    23,
    24,
    25,
    26,
    27
   ],
   "tokens": [
    128000,
    128006,
    9125,
    128007,
    271,
    16533,
    279,
    3488,
    1701,
    1193,
    279,
    4823,
    2246,
    13,
    22559,
    304,
    832,
    2875,
    11914,
    13,
    128009,
    128006,
    882,
    128007,
    271,
    5483,
    2246,
    1473
   ],
   "n_markup": 9,
   "text": "<|begin_of_text|><|start_header_id|>system<|end_header_id|>\n\nAnswer the question using only the JSON document. Answer in one short sentence.<|eot_id|><|start_header_id|>user<|end_header_id|>\n\nJSON document:\n\n"
  },
  {
   "id": 1,
   "parent": 0,
   "node_type": "object",
   "title": "box_office",
   "seq_ids": [
    1
   ],
   "positions": [
    28,
    29,
    30,
    31,
    32,
    33,
    34,
    35,
    36,
    37,
    38,
    39,
    40,
    41,
    42,
    43,
    44,
    45,
    46,
    47,
    48,
    49,
    50,
    51,
    52,
    53,
    54,
    55,
    56,
    57,
    58
   ],
   "tokens": [
    1,
    2054,
    80704,
    794,
    341,
    1,
    49506,
    1265,
    81,
    33431,
    794,
    220,
    5313,
    345,
    60819,
    2177,
    1265,
    81,
    33431,
    794,
    220,
    8273,
    345,
    1,
    424,
    8644,
    794,
    330,
    23306,
    761,
    534
   ],
   "n_markup": 15,
   "text": "\"box_office\": {\n\"budget_inr_cr\": 85,\n\"gross_inr_cr\": 240,\n\"verdict\": \"hit\",\n}\n"
  },
  {
   "id": 2,
   "parent": 0,
   "node_type": "array",
   "title": "cast",
   "seq_ids": [
    2,
    3,
    4,
    5
   ],
   "positions": [
    28,
    29,
    30,
    31,
    32
   ],
   "tokens": [
    1,
    3914,
    794,
    2330,
    933
   ],
   "n_markup": 4,
   "text": "\"cast\": [\n]\n"
  },
  {
   "id": 3,
   "parent": 2,
   "node_type": "object",
   "title": "cast[0]",
   "seq_ids": [
    3
   ],
   "positions": [
    33,
    34,
    35,
    36,
    37,
    38,
    39,
    40,
    41,
    42,
    43,
    44,
    45,
    46,
    47,
    48,
    49,
    50
   ],
   "tokens": [
    1,
    15,
    794,
    341,
    32586,
    794,
    330,
    32,
    13,
    89000,
    761,
    1,
    5898,
    794,
    330,
    27152,
    761,
    534
   ],
   "n_markup": 11,
   "text": "\"0\": {\n\"name\": \"A. Rao\",\n\"role\": \"lead\",\n}\n"
  },
  {
   "id": 4,
   "parent": 2,
   "node_type": "object",
   "title": "cast[1]",
   "seq_ids": [
    4
   ],
   "positions": [
    33,
    34,
    35,
    36,
    37,
    38,
    39,
    40,
    41,
    42,
    43,
    44,
    45,
    46,
    47,
    48,
    49,
    50,
    51
   ],
   "tokens": [
    1,
    16,
    794,
    341,
    32586,
    794,
    330,
    50,
    13,
    358,
    27253,
    761,
    1,
    5898,
    794,
    330,
    24249,
    761,
    534
   ],
   "n_markup": 11,
   "text": "\"1\": {\n\"name\": \"S. Iyer\",\n\"role\": \"support\",\n}\n"
  },
  {
   "id": 5,
   "parent": 2,
   "node_type": "object",
   "title": "cast[2]",
   "seq_ids": [
    5
   ],
   "positions": [
    33,
    34,
    35,
    36,
    37,
    38,
    39,
    40,
    41,
    42,
    43,
    44,
    45,
    46,
    47,
    48,
    49,
    50,
    51,
    52
   ],
   "tokens": [
    1,
    17,
    794,
    341,
    32586,
    794,
    330,
    42,
    13,
    11258,
    263,
    761,
    1,
    5898,
    794,
    330,
    6142,
    78,
    761,
    534
   ],
   "n_markup": 11,
   "text": "\"2\": {\n\"name\": \"K. Menon\",\n\"role\": \"cameo\",\n}\n"
  },
  {
   "id": 6,
   "parent": 0,
   "node_type": "object",
   "title": "crew",
   "seq_ids": [
    6
   ],
   "positions": [
    28,
    29,
    30,
    31,
    32,
    33,
    34,
    35,
    36,
    37,
    38,
    39,
    40,
    41,
    42,
    43,
    44,
    45,
    46,
    47,
    48,
    49,
    50,
    51,
    52,
    53,
    54,
    55,
    56,
    57,
    58
   ],
   "tokens": [
    1,
    39717,
    794,
    341,
    1,
    70895,
    794,
    330,
    7979,
    2473,
    62064,
    19285,
    761,
    46017,
    454,
    794,
    330,
    49,
    13,
    37617,
    761,
    1,
    32261,
    794,
    330,
    41,
    13,
    423,
    13279,
    761,
    534
   ],
   "n_markup": 15,
   "text": "\"crew\": {\n\"director\": \"Meera Krishnan\",\n\"dop\": \"R. Shah\",\n\"music\": \"J. Dhar\",\n}\n"
  },
  {
   "id": 7,
   "parent": 0,
   "node_type": "object",
   "title": "ratings",
   "seq_ids": [
    7
   ],
   "positions": [
    28,
    29,
    30,
    31,
    32,
    33,
    34,
    35,
    36,
    37,
    38,
    39,
    40,
    41,
    42,
    43,
    44,
    45,
    46,
    47,
    48,
    49,
    50,
    51,
    52,
    53,
    54,
    55,
    56,
    57,
    58
   ],
   "tokens": [
    1,
    74236,
    794,
    341,
    1,
    318,
    2042,
    794,
    220,
    23,
    13,
    16,
    345,
    1,
    4744,
    2002,
    530,
    316,
    20798,
    794,
    220,
    6083,
    345,
    1,
    38935,
    794,
    220,
    17574,
    410,
    345,
    534
   ],
   "n_markup": 16,
   "text": "\"ratings\": {\n\"imdb\": 8.1,\n\"rotten_tomatoes\": 92,\n\"votes\": 41200,\n}\n"
  },
  {
   "id": 8,
   "parent": 0,
   "node_type": "object",
   "title": "title",
   "seq_ids": [
    8
   ],
   "positions": [
    28,
    29,
    30,
    31,
    32,
    33,
    34,
    35,
    36,
    37,
    38,
    39,
    40,
    41,
    42,
    43,
    44,
    45,
    46,
    47,
    48,
    49,
    50,
    51,
    52,
    53
   ],
   "tokens": [
    83827,
    794,
    341,
    1,
    11789,
    794,
    330,
    30700,
    352,
    17243,
    761,
    32586,
    794,
    330,
    60265,
    21543,
    8828,
    761,
    1,
    3236,
    794,
    220,
    2366,
    20,
    345,
    534
   ],
   "n_markup": 14,
   "text": "\"title\": {\n\"language\": \"Malayalam\",\n\"name\": \"Greyhook Light\",\n\"year\": 2025,\n}\n"
  }
 ]
}