{
 "schema_version": 1,
 "domain": "chatlogs",
 "source": "flight_booking.json",
 "model": "Llama-3.2-1B-Instruct-Q4_K_M.gguf",
 "merge": {
  "min_leaf_tokens": 48,
  "max_nodes": 48,
  "nodes_before_merge": 17
 },
 "n_tokens": 239,
 "nodes": [
  {
   "id": 0,
   "parent": null,
   "node_type": "document",
   "title": "(document)",
   "seq_ids": [
    0,
    1,
    2,
    3,
    4,
    5,
    6,
    7,
    8
   ],
   "positions": [
    0,
    1,
    2,
    3,
    4,
    5,
    6,
    7,
    8,
    9,
    10,
    11,
    12,
    13,
    14,
    15,
    16,
    17,
    18,
    19,
    20,
    21,
    22,
    23,
    24,
    25,
    26,
    27
   ],
   "tokens": [
    128000,
    128006,
    9125,
    128007,
    271,
    16533,
    279,
    3488,
    1701,
    1193,
    279,
    10652,
    1515,
    13,
    22559,
    304,
    832,
    2875,
    11914,
    13,
    128009,
    128006,
    882,
    128007,
    271,
    61413,
    1515,
    1473
   ],
   "n_markup": 9,
   "text": "<|begin_of_text|><|start_header_id|>system<|end_header_id|>\n\nAnswer the question using only the conversation log. Answer in one short sentence.<|eot_id|><|start_header_id|>user<|end_header_id|>\n\nConversation log:\n\n"
  },
  {
   "id": 1,
   "parent": 0,
   "node_type": "turn",
   "title": "turn 1 user",
   "seq_ids": [
    1
   ],
   "positions": [
    28,
    29,
    30,
    31,
    32,
    33,
    34,
    35,
    36,
    37,
    38,
    39,
    40,
    41,
    42,
    43,
    44,
    45,
    46,
    47,
    48,
    49
   ],
   "tokens": [
    14711,
    2543,
    220,
    16,
    510,
    882,
    933,
    40,
    1205,
    264,
    6693,
    11213,
    505,
    15195,
    49,
    311,
    24711,
    389,
    4723,
    220,
    17,
    382
   ],
   "n_markup": 5,
   "text": "### turn 1 [user]\nI need a morning flight from BLR to DEL on Nov 2.\n\n"
  },
  {
   "id": 2,
   "parent": 0,
   "node_type": "turn",
   "title": "turn 2 assistant",
   "seq_ids": [
    2,
    3
   ],
   "positions": [
    28,
    29,
    30,
    31,
    32,
    33,
    34,
    35,
    36,
    37,
    38,
    39,
    40
   ],
   "tokens": [
    14711,
    2543,
    220,
    17,
    510,
    78191,
    933,
    69160,
    6693,
    25952,
    369,
    499,
    382
   ],
   "n_markup": 4,
   "text": "### turn 2 [assistant]\nSearching morning flights for you.\n\n"
  },
  {
   "id": 3,
   "parent": 2,
   "node_type": "tool_call",
   "title": "turn 2 search_flights",
   "seq_ids": [
    3
   ],
   "positions": [
    41,
    42,
    43,
    44,
    45,
    46,
    47,
    48,
    49,
    50,
    51,
    52,
    53,
    54,
    55,
    56,
    57,
    58,
    59,
    60,
    61,
    62,
    63,
    64,
    65,
    66,
    67,
    68,
    69,
    70,
    71,
    72,
    73,
    74,
    75,
    76,
    77,
    78,
    79,
    80,
    81,
    82,
    83,
    84,
    85,
    86,
    87,
    88,
    89,
    90,
    91,
    92,
    93,
    94,
    95,
    96
   ],
   "tokens": [
    6797,
    272,
    16,
    2778,
    5191,
    2866,
    17289,
    1045,
    794,
    330,
    2366,
    21,
    12,
    806,
    12,
    2437,
    498,
    330,
    1527,
    794,
    330,
    9574,
    49,
    498,
    330,
    998,
    794,
    330,
    39432,
    24546,
    1407,
    25,
    12595,
    507,
    55,
    12,
    12652,
    81573,
    220,
    2705,
    25,
    1272,
    11,
    33111,
    220,
    2545,
    25,
    868,
    11,
    8752,
    2006,
    49,
    220,
    24313,
    15,
    382
   ],
   "n_markup": 19,
   "text": "call c1 search_flights({\"date\": \"2026-11-02\", \"from\": \"BLR\", \"to\": \"DEL\"})\nresult: Found OX-209 departing 06:40, arriving 09:15, economy INR 6840.\n\n"
  },
  {
   "id": 4,
   "parent": 0,
   "node_type": "turn",
   "title": "turn 4 assistant",
   "seq_ids": [
    4
   ],
   "positions": [
    28,
    29,
    30,
    31,
    32,
    33,
    34,
    35,
    36,
    37,
    38,
    39,
    40,
    41,
    42,
    43,
    44,
    45,
    46,
    47,
    48,
    49,
    50
   ],
   "tokens": [
    14711,
    2543,
    220,
    19,
    510,
    78191,
    933,
    61255,
    12,
    12652,
    520,
    220,
    2705,
    25,
    1272,
    5992,
    1695,
    13,
    6017,
    832,
    8752,
    10954,
    1980
   ],
   "n_markup": 7,
   "text": "### turn 4 [assistant]\nOX-209 at 06:40 looks good. Book one economy seat?\n\n"
  },
  {
   "id": 5,
   "parent": 0,
   "node_type": "turn",
   "title": "turn 5 user",
   "seq_ids": [
    5
   ],
   "positions": [
    28,
    29,
    30,
    31,
    32,
    33,
    34,
    35,
    36,
    37,
    38,
    39,
    40,
    41,
    42,
    43,
    44,
    45
   ],
   "tokens": [
    14711,
    2543,
    220,
    20,
    510,
    882,
    933,
    9642,
    11,
    2363,
    433,
    13,
    68734,
    2467,
    488,
    64,
    71841,
    382
   ],
   "n_markup": 4,
   "text": "### turn 5 [user]\nYes, book it. Passenger Aditya Sai.\n\n"
  },
  {
   "id": 6,
   "parent": 0,
   "node_type": "turn",
   "title": "turn 6 assistant",
   "seq_ids": [
    6,
    7
   ],
   "positions": [
    28,
    29,
    30,
    31,
    32,
    33,
    34,
    35,
    36,
    37
   ],
   "tokens": [
    14711,
    2543,
    220,
    21,
    510,
    78191,
    933,
    42928,
    1457,
    382
   ],
   "n_markup": 4,
   "text": "### turn 6 [assistant]\nBooking now.\n\n"
  },
  {
   "id": 7,
   "parent": 6,
   "node_type": "tool_call",
   "title": "turn 6 book_flight",
   "seq_ids": [
    7
   ],
   "positions": [
    38,
    39,
    40,
    41,
    42,
    43,
    44,
    45,
    46,
    47,
    48,
    49,
    50,
    51,
    52,
    53,
    54,
    55,
    56,
    57,
    58,
    59,
    60,
    61,
    62,
    63,
    64,
    65,
    66,
    67,
    68,
    69,
    70,
    71,
    72,
    73,
    74,
    75,
    76,
    77,
    78
   ],
   "tokens": [
    6797,
    272,
    17,
    2363,
    91470,
    17289,
    39490,
    794,
    330,
    61255,
    12,
    12652,
    498,
    330,
    609,
    794,
    330,
    2654,
    488,
    64,
    71841,
    24546,
    1407,
    25,
    6017,
    291,
    13,
    69409,
    2082,
    507,
    55,
    24,
    42,
    17,
    48,
    11,
    10954,
    220,
    975,
    32,
    382
   ],
   "n_markup": 10,
   "text": "call c2 book_flight({\"flight\": \"OX-209\", \"name\": \"Aditya Sai\"})\nresult: Booked. Confirmation code OX9K2Q, seat 14A.\n\n"
  },
  {
   "id": 8,
   "parent": 0,
   "node_type": "turn",
   "title": "turn 8 assistant",
   "seq_ids": [
    8
   ],
   "positions": [
    28,
    29,
    30,
    31,
    32,
    33,
    34,
    35,
    36,
    37,
    38,
    39,
    40,
    41,
    42,
    43,
    44,
    45,
    46,
    47,
    48,
    49,
    50,
    51,
    52,
    53,
    54,
    55
   ],
   "tokens": [
    14711,
    2543,
    220,
    23,
    510,
    78191,
    933,
    17911,
    0,
    69409,
    2082,
    507,
    55,
    24,
    42,
    17,
    48,
    11,
    10954,
    220,
    975,
    32,
    389,
    507,
    55,
    12,
    12652,
    382
   ],
   "n_markup": 6,
   "text": "### turn 8 [assistant]\nDone! Confirmation code OX9K2Q, seat 14A on OX-209.\n\n"
  }
 ]
}