{
 "schema_version": 1,
 "domain": "chatlogs",
 "source": "restaurant_reserve.json",
 "model": "Llama-3.2-1B-Instruct-Q4_K_M.gguf",
 "merge": {
  "min_leaf_tokens": 48,
  "max_nodes": 48,
  "nodes_before_merge": 17
 },
 "n_tokens": 201,
 "nodes": [
  {
   "id": 0,
   "parent": null,
   "node_type": "document",
   "title": "(document)",
   "seq_ids": [
    0,
    1,
    2,
    3,
    4,
    5,
    6,
    7,
    8
   ],
   "positions": [
    0,
    1,
    2,
    3,
    4,
    5,
    6,
    7,
    8,
    9,
    10,
    11,
    12,
    13,
    14,
    15,
    16,
    17,
    18,
    19,
    20,
    21,
    22,
    23,
    24,
    25,
    26,
    27
   ],
   "tokens": [
    128000,
    128006,
    9125,
    128007,
    271,
    16533,
    279,
    3488,
    1701,
    1193,
    279,
    10652,
    1515,
    13,
    22559,
    304,
    832,
    2875,
    11914,
    13,
    128009,
    128006,
    882,
    128007,
    271,
    61413,
    1515,
    1473
   ],
   "n_markup": 9,
   "text": "<|begin_of_text|><|start_header_id|>system<|end_header_id|>\n\nAnswer the question using only the conversation log. Answer in one short sentence.<|eot_id|><|start_header_id|>user<|end_header_id|>\n\nConversation log:\n\n"
  },
  {
   "id": 1,
   "parent": 0,
   "node_type": "turn",
   "title": "turn 1 user",
   "seq_ids": [
    1
   ],
   "positions": [
    28,
    29,
    30,
    31,
    32,
    33,
    34,
    35,
    36,
    37,
    38,
    39,
    40,
    41,
    42,
    43,
    44,
    45,
    46
   ],
   "tokens": [
    14711,
    2543,
    220,
    16,
    510,
    882,
    933,
    7280,
    264,
    2007,
    369,
    220,
    17,
    3221,
    279,
    75742,
    369,
    18396,
    382
   ],
   "n_markup": 5,
   "text": "### turn 1 [user]\nBook a table for 2 near the harbour for tonight.\n\n"
  },
  {
   "id": 2,
   "parent": 0,
   "node_type": "turn",
   "title": "turn 2 assistant",
   "seq_ids": [
    2,
    3
   ],
   "positions": [
    28,
    29,
    30,
    31,
    32,
    33,
    34,
    35,
    36,
    37,
    38,
    39,
    40
   ],
   "tokens": [
    14711,
    2543,
    220,
    17,
    510,
    78191,
    933,
    41229,
    18539,
    323,
    279,
    5130,
    382
   ],
   "n_markup": 4,
   "text": "### turn 2 [assistant]\nChecking availability and the menu.\n\n"
  },
  {
   "id": 3,
   "parent": 2,
   "node_type": "tool_call",
   "title": "turn 2 check_tables",
   "seq_ids": [
    3
   ],
   "positions": [
    41,
    42,
    43,
    44,
    45,
    46,
    47,
    48,
    49,
    50,
    51,
    52,
    53,
    54,
    55,
    56,
    57,
    58,
    59,
    60,
    61,
    62,
    63,
    64,
    65,
    66,
    67,
    68,
    69,
    70,
    71,
    72,
    73,
    74,
    75,
    76
   ],
   "tokens": [
    6797,
    272,
    16,
    1817,
    36732,
    17289,
    4903,
    794,
    330,
    13279,
    15747,
    498,
    330,
    34057,
    794,
    220,
    17,
    3602,
    1407,
    25,
    63107,
    17019,
    8152,
    14321,
    706,
    12920,
    26,
    279,
    743,
    5130,
    374,
    7795,
    55178,
    323,
    20228,
    382
   ],
   "n_markup": 8,
   "text": "call c1 check_tables({\"area\": \"harbour\", \"party\": 2})\nresult: Harbour Fish Market hall has tables; the set menu is fish curry and rice.\n\n"
  },
  {
   "id": 4,
   "parent": 0,
   "node_type": "turn",
   "title": "turn 4 assistant",
   "seq_ids": [
    4
   ],
   "positions": [
    28,
    29,
    30,
    31,
    32,
    33,
    34,
    35,
    36,
    37,
    38,
    39,
    40
   ],
   "tokens": [
    14711,
    2543,
    220,
    19,
    510,
    78191,
    933,
    22409,
    2561,
    13,
    3639,
    892,
    1980
   ],
   "n_markup": 4,
   "text": "### turn 4 [assistant]\nTables available. What time?\n\n"
  },
  {
   "id": 5,
   "parent": 0,
   "node_type": "turn",
   "title": "turn 5 user",
   "seq_ids": [
    5
   ],
   "positions": [
    28,
    29,
    30,
    31,
    32,
    33,
    34,
    35,
    36,
    37,
    38,
    39,
    40,
    41,
    42
   ],
   "tokens": [
    14711,
    2543,
    220,
    20,
    510,
    882,
    933,
    23,
    5298,
    11,
    836,
    2467,
    488,
    64,
    382
   ],
   "n_markup": 4,
   "text": "### turn 5 [user]\n8pm, name Aditya.\n\n"
  },
  {
   "id": 6,
   "parent": 0,
   "node_type": "turn",
   "title": "turn 6 assistant",
   "seq_ids": [
    6,
    7
   ],
   "positions": [
    28,
    29,
    30,
    31,
    32,
    33,
    34,
    35,
    36,
    37,
    38
   ],
   "tokens": [
    14711,
    2543,
    220,
    21,
    510,
    78191,
    933,
    1079,
    20073,
    1457,
    382
   ],
   "n_markup": 4,
   "text": "### turn 6 [assistant]\nReserving now.\n\n"
  },
  {
   "id": 7,
   "parent": 6,
   "node_type": "tool_call",
   "title": "turn 6 reserve_table",
   "seq_ids": [
    7
   ],
   "positions": [
    39,
    40,
    41,
    42,
    43,
    44,
    45,
    46,
    47,
    48,
    49,
    50,
    51,
    52,
    53,
    54,
    55,
    56,
    57,
    58,
    59,
    60,
    61,
    62,
    63,
    64,
    65,
    66,
    67,
    68,
    69,
    70,
    71,
    72,
    73,
    74,
    75,
    76,
    77,
    78,
    79,
    80,
    81,
    82
   ],
   "tokens": [
    6797,
    272,
    17,
    21137,
    5350,
    17289,
    609,
    794,
    330,
    2654,
    488,
    64,
    498,
    330,
    34057,
    794,
    220,
    17,
    11,
    330,
    1712,
    794,
    330,
    508,
    25,
    410,
    24546,
    1407,
    25,
    15516,
    2007,
    350,
    12,
    972,
    369,
    220,
    508,
    25,
    410,
    1234,
    2467,
    488,
    64,
    382
   ],
   "n_markup": 15,
   "text": "call c2 reserve_table({\"name\": \"Aditya\", \"party\": 2, \"time\": \"20:00\"})\nresult: Reserved table T-18 for 20:00 under Aditya.\n\n"
  },
  {
   "id": 8,
   "parent": 0,
   "node_type": "turn",
   "title": "turn 8 assistant",
   "seq_ids": [
    8
   ],
   "positions": [
    28,
    29,
    30,
    31,
    32,
    33,
    34,
    35,
    36,
    37,
    38,
    39,
    40,
    41,
    42,
    43,
    44,
    45,
    46,
    47,
    48,
    49
   ],
   "tokens": [
    14711,
    2543,
    220,
    23,
    510,
    78191,
    933,
    7280,
    291,
    2007,
    350,
    12,
    972,
    369,
    220,
    23,
    5298,
    1234,
    2467,
    488,
    64,
    382
   ],
   "n_markup": 6,
   "text": "### turn 8 [assistant]\nBooked table T-18 for 8pm under Aditya.\n\n"
  }
 ]
}