{
 "schema_version": 1,
 "domain": "json",
 "source": "github_repo.json",
 "model": "Llama-3.2-1B-Instruct-Q4_K_M.gguf",
 "merge": {
  "min_leaf_tokens": 48,
  "max_nodes": 48,
  "nodes_before_merge": 48
 },
 "n_tokens": 294,
 "nodes": [
  {
   "id": 0,
   "parent": null,
   "node_type": "document",
   "title": "(document)",
   "seq_ids": [
    0,
    1,
    2,
    3,
    4,
    5,
    6,
    7,
    8,
    9,
    10
   ],
   "positions": [
    0,
    1,
    2,
    3,
    4,
    5,
    6,
    7,
    8,
    9,
    10,
    11,
    12,
    13,
    14,
    15,
    16,
    17,
    18,
    19,
    20,
    21,
    22,
    23,
    24,
    25,
    26,
    27
   ],
   "tokens": [
    128000,
    128006,
    9125,
    128007,
    271,
    16533,
    279,
    3488,
    1701,
    1193,
    279,
    4823,
    2246,
    13,
    22559,
    304,
    832,
    2875,
    11914,
    13,
    128009,
    128006,
    882,
    128007,
    271,
    5483,
    2246,
    1473
   ],
   "n_markup": 9,
   "text": "<|begin_of_text|><|start_header_id|>system<|end_header_id|>\n\nAnswer the question using only the JSON document. Answer in one short sentence.<|eot_id|><|start_header_id|>user<|end_header_id|>\n\nJSON document:\n\n"
  },
  {
   "id": 1,
   "parent": 0,
   "node_type": "array",
   "title": "issues",
   "seq_ids": [
    1,
    2,
    3,
    4
   ],
   "positions": [
    28,
    29,
    30,
    31,
    32
   ],
   "tokens": [
    1,
    18934,
    794,
    2330,
    933
   ],
   "n_markup": 4,
   "text": "\"issues\": [\n]\n"
  },
  {
   "id": 2,
   "parent": 1,
   "node_type": "object",
   "title": "issues[0]",
   "seq_ids": [
    2
   ],
   "positions": [
    33,
    34,
    35,
    36,
    37,
    38,
    39,
    40,
    41,
    42,
    43,
    44,
    45,
    46,
    47,
    48,
    49,
    50,
    51,
    52,
    53,
    54,
    55,
    56,
    57,
    58,
    59,
    60,
    61,
    62,
    63,
    64,
    65,
    66,
    67
   ],
   "tokens": [
    1,
    15,
    794,
    341,
    1,
    7128,
    2176,
    794,
    330,
    329,
    488,
    64,
    761,
    29800,
    794,
    220,
    17574,
    345,
    1,
    2513,
    794,
    330,
    2569,
    761,
    83827,
    794,
    330,
    16384,
    1003,
    389,
    4384,
    2242,
    1052,
    761,
    534
   ],
   "n_markup": 18,
   "text": "\"0\": {\n\"assignee\": \"aditya\",\n\"id\": 412,\n\"state\": \"open\",\n\"title\": \"Crash on empty config file\",\n}\n"
  },
  {
   "id": 3,
   "parent": 1,
   "node_type": "object",
   "title": "issues[1]",
   "seq_ids": [
    3
   ],
   "positions": [
    33,
    34,
    35,
    36,
    37,
    38,
    39,
    40,
    41,
    42,
    43,
    44,
    45,
    46,
    47,
    48,
    49,
    50,
    51,
    52,
    53,
    54,
    55,
    56,
    57,
    58,
    59,
    60,
    61,
    62,
    63,
    64,
    65,
    66
   ],
   "tokens": [
    1,
    16,
    794,
    341,
    1,
    7128,
    2176,
    794,
    330,
    65,
    391,
    292,
    761,
    29800,
    794,
    220,
    18058,
    345,
    1,
    2513,
    794,
    330,
    35187,
    761,
    83827,
    794,
    330,
    64207,
    86205,
    304,
    4062,
    2527,
    761,
    534
   ],
   "n_markup": 18,
   "text": "\"1\": {\n\"assignee\": \"bapic\",\n\"id\": 408,\n\"state\": \"closed\",\n\"title\": \"Docs typo in quickstart\",\n}\n"
  },
  {
   "id": 4,
   "parent": 1,
   "node_type": "object",
   "title": "issues[2]",
   "seq_ids": [
    4
   ],
   "positions": [
    33,
    34,
    35,
    36,
    37,
    38,
    39,
    40,
    41,
    42,
    43,
    44,
    45,
    46,
    47,
    48,
    49,
    50,
    51,
    52,
    53,
    54,
    55,
    56,
    57,
    58,
    59,
    60,
    61,
    62,
    63,
    64,
    65,
    66
   ],
   "tokens": [
    1,
    17,
    794,
    341,
    1,
    7128,
    2176,
    794,
    854,
    345,
    29800,
    794,
    220,
    10841,
    345,
    1,
    2513,
    794,
    330,
    2569,
    761,
    83827,
    794,
    330,
    59389,
    864,
    7712,
    389,
    220,
    23,
    24357,
    14266,
    761,
    534
   ],
   "n_markup": 18,
   "text": "\"2\": {\n\"assignee\": null,\n\"id\": 401,\n\"state\": \"open\",\n\"title\": \"Slow prefill on 8-core CPU\",\n}\n"
  },
  {
   "id": 5,
   "parent": 0,
   "node_type": "object",
   "title": "owner",
   "seq_ids": [
    5
   ],
   "positions": [
    28,
    29,
    30,
    31,
    32,
    33,
    34,
    35,
    36,
    37,
    38,
    39,
    40,
    41,
    42,
    43,
    44,
    45,
    46,
    47
   ],
   "tokens": [
    1,
    8281,
    794,
    341,
    1,
    3758,
    794,
    330,
    65,
    391,
    292,
    2922,
    370,
    761,
    45570,
    794,
    330,
    1813,
    761,
    534
   ],
   "n_markup": 11,
   "text": "\"owner\": {\n\"login\": \"bapic-lab\",\n\"type\": \"org\",\n}\n"
  },
  {
   "id": 6,
   "parent": 0,
   "node_type": "array",
   "title": "releases",
   "seq_ids": [
    6,
    7,
    8
   ],
   "positions": [
    28,
    29,
    30,
    31,
    32,
    33
   ],
   "tokens": [
    1,
    265,
    29399,
    794,
    2330,
    933
   ],
   "n_markup": 4,
   "text": "\"releases\": [\n]\n"
  },
  {
   "id": 7,
   "parent": 6,
   "node_type": "object",
   "title": "releases[0]",
   "seq_ids": [
    7
   ],
   "positions": [
    34,
    35,
    36,
    37,
    38,
    39,
    40,
    41,
    42,
    43,
    44,
    45,
    46,
    47,
    48,
    49,
    50,
    51,
    52,
    53,
    54,
    55,
    56,
    57,
    58,
    59,
    60,
    61,
    62,
    63,
    64,
    65,
    66,
    67,
    68,
    69,
    70,
    71
   ],
   "tokens": [
    1,
    15,
    794,
    341,
    1,
    18790,
    794,
    330,
    98557,
    8668,
    29460,
    323,
    85748,
    79336,
    10560,
    1,
    33966,
    794,
    330,
    2366,
    21,
    12,
    2545,
    12,
    717,
    761,
    1,
    4681,
    794,
    330,
    85,
    18,
    13,
    15,
    13,
    15,
    761,
    534
   ],
   "n_markup": 15,
   "text": "\"0\": {\n\"notes\": \"Structured sequence IDs and KV eviction.\",\n\"published\": \"2026-09-12\",\n\"tag\": \"v3.0.0\",\n}\n"
  },
  {
   "id": 8,
   "parent": 6,
   "node_type": "object",
   "title": "releases[1]",
   "seq_ids": [
    8
   ],
   "positions": [
    34,
    35,
    36,
    37,
    38,
    39,
    40,
    41,
    42,
    43,
    44,
    45,
    46,
    47,
    48,
    49,
    50,
    51,
    52,
    53,
    54,
    55,
    56,
    57,
    58,
    59,
    60,
    61,
    62,
    63,
    64,
    65,
    66,
    67,
    68
   ],
   "tokens": [
    1,
    16,
    794,
    341,
    1,
    18790,
    794,
    330,
    47873,
    5862,
    4984,
    10560,
    1,
    33966,
    794,
    330,
    2366,
    21,
    12,
    2705,
    12,
    2437,
    761,
    1,
    4681,
    794,
    330,
    85,
    17,
    13,
    24,
    13,
    16,
    761,
    534
   ],
   "n_markup": 15,
   "text": "\"1\": {\n\"notes\": \"Bugfix release.\",\n\"published\": \"2026-06-02\",\n\"tag\": \"v2.9.1\",\n}\n"
  },
  {
   "id": 9,
   "parent": 0,
   "node_type": "object",
   "title": "repository",
   "seq_ids": [
    9
   ],
   "positions": [
    28,
    29,
    30,
    31,
    32,
    33,
    34,
    35,
    36,
    37,
    38,
    39,
    40,
    41,
    42,
    43,
    44,
    45,
    46,
    47,
    48,
    49,
    50,
    51,
    52,
    53
   ],
   "tokens": [
    1,
    24202,
    794,
    341,
    1,
    11789,
    794,
    330,
    34,
    1044,
    761,
    1,
    13569,
    794,
    330,
    18836,
    761,
    32586,
    794,
    330,
    52971,
    1091,
    2473,
    20024,
    761,
    534
   ],
   "n_markup": 15,
   "text": "\"repository\": {\n\"language\": \"C++\",\n\"license\": \"MIT\",\n\"name\": \"bhaskera-col\",\n}\n"
  },
  {
   "id": 10,
   "parent": 0,
   "node_type": "object",
   "title": "stats",
   "seq_ids": [
    10
   ],
   "positions": [
    28,
    29,
    30,
    31,
    32,
    33,
    34,
    35,
    36,
    37,
    38,
    39,
    40,
    41,
    42,
    43,
    44,
    45,
    46,
    47,
    48,
    49,
    50,
    51,
    52,
    53,
    54,
    55,
    56,
    57,
    58,
    59,
    60
   ],
   "tokens": [
    1,
    16658,
    794,
    341,
    1,
    45838,
    82,
    794,
    220,
    3174,
    345,
    1,
    2569,
    91332,
    794,
    220,
    1114,
    345,
    1,
    37738,
    794,
    220,
    4386,
    19,
    345,
    1,
    14658,
    388,
    794,
    220,
    4161,
    345,
    534
   ],
   "n_markup": 20,
   "text": "\"stats\": {\n\"forks\": 41,\n\"open_issues\": 17,\n\"stars\": 1284,\n\"watchers\": 96,\n}\n"
  }
 ]
}