{
 "schema_version": 1,
 "domain": "chatlogs",
 "source": "weather_lookup.json",
 "model": "Llama-3.2-1B-Instruct-Q4_K_M.gguf",
 "merge": {
  "min_leaf_tokens": 48,
  "max_nodes": 48,
  "nodes_before_merge": 17
 },
 "n_tokens": 204,
 "nodes": [
  {
   "id": 0,
   "parent": null,
   "node_type": "document",
   "title": "(document)",
   "seq_ids": [
    0,
    1,
    2,
    3,
    4,
    5,
    6,
    7,
    8
   ],
   "positions": [
    0,
    1,
    2,
    3,
    4,
    5,
    6,
    7,
    8,
    9,
    10,
    11,
    12,
    13,
    14,
    15,
    16,
    17,
    18,
    19,
    20,
    21,
    22,
    23,
    24,
    25,
    26,
    27
   ],
   "tokens": [
    128000,
    128006,
    9125,
    128007,
    271,
    16533,
    279,
    3488,
    1701,
    1193,
    279,
    10652,
    1515,
    13,
    22559,
    304,
    832,
    2875,
    11914,
    13,
    128009,
    128006,
    882,
    128007,
    271,
    61413,
    1515,
    1473
   ],
   "n_markup": 9,
   "text": "<|begin_of_text|><|start_header_id|>system<|end_header_id|>\n\nAnswer the question using only the conversation log. Answer in one short sentence.<|eot_id|><|start_header_id|>user<|end_header_id|>\n\nConversation log:\n\n"
  },
  {
   "id": 1,
   "parent": 0,
   "node_type": "turn",
   "title": "turn 1 user",
   "seq_ids": [
    1
   ],
   "positions": [
    28,
    29,
    30,
    31,
    32,
    33,
    34,
    35,
    36,
    37,
    38,
    39,
    40,
    41,
    42,
    43,
    44,
    45,
    46
   ],
   "tokens": [
    14711,
    2543,
    220,
    16,
    510,
    882,
    933,
    3923,
    374,
    279,
    9282,
    304,
    5896,
    362,
    899,
    258,
    1314,
    1457,
    1980
   ],
   "n_markup": 4,
   "text": "### turn 1 [user]\nWhat is the weather in Port Avelin right now?\n\n"
  },
  {
   "id": 2,
   "parent": 0,
   "node_type": "turn",
   "title": "turn 2 assistant",
   "seq_ids": [
    2,
    3
   ],
   "positions": [
    28,
    29,
    30,
    31,
    32,
    33,
    34,
    35,
    36,
    37,
    38,
    39
   ],
   "tokens": [
    14711,
    2543,
    220,
    17,
    510,
    78191,
    933,
    41229,
    279,
    75742,
    8216,
    382
   ],
   "n_markup": 4,
   "text": "### turn 2 [assistant]\nChecking the harbour station.\n\n"
  },
  {
   "id": 3,
   "parent": 2,
   "node_type": "tool_call",
   "title": "turn 2 get_weather",
   "seq_ids": [
    3
   ],
   "positions": [
    40,
    41,
    42,
    43,
    44,
    45,
    46,
    47,
    48,
    49,
    50,
    51,
    52,
    53,
    54,
    55,
    56,
    57,
    58,
    59,
    60,
    61,
    62,
    63,
    64,
    65,
    66,
    67,
    68,
    69,
    70,
    71,
    72,
    73,
    74,
    75,
    76,
    77,
    78,
    79,
    80,
    81,
    82,
    83
   ],
   "tokens": [
    6797,
    272,
    16,
    636,
    70464,
    17289,
    9103,
    794,
    330,
    7229,
    362,
    899,
    258,
    24546,
    1407,
    25,
    5896,
    362,
    899,
    258,
    25,
    40798,
    11,
    220,
    2148,
    34,
    11,
    38193,
    220,
    1987,
    14697,
    7429,
    10273,
    4923,
    14210,
    10951,
    6931,
    25,
    63857,
    11,
    220,
    1187,
    34,
    382
   ],
   "n_markup": 10,
   "text": "call c1 get_weather({\"city\": \"Port Avelin\"})\nresult: Port Avelin: sunny, 31C, humidity 38%. Also checked Skerra Island earlier: rainy, 24C.\n\n"
  },
  {
   "id": 4,
   "parent": 0,
   "node_type": "turn",
   "title": "turn 4 assistant",
   "seq_ids": [
    4
   ],
   "positions": [
    28,
    29,
    30,
    31,
    32,
    33,
    34,
    35,
    36,
    37,
    38,
    39,
    40,
    41,
    42,
    43,
    44,
    45,
    46,
    47
   ],
   "tokens": [
    14711,
    2543,
    220,
    19,
    510,
    78191,
    933,
    2181,
    374,
    40798,
    323,
    220,
    2148,
    34,
    304,
    5896,
    362,
    899,
    258,
    382
   ],
   "n_markup": 5,
   "text": "### turn 4 [assistant]\nIt is sunny and 31C in Port Avelin.\n\n"
  },
  {
   "id": 5,
   "parent": 0,
   "node_type": "turn",
   "title": "turn 5 user",
   "seq_ids": [
    5
   ],
   "positions": [
    28,
    29,
    30,
    31,
    32,
    33,
    34,
    35,
    36,
    37,
    38
   ],
   "tokens": [
    14711,
    2543,
    220,
    20,
    510,
    882,
    933,
    3112,
    16986,
    13658,
    1980
   ],
   "n_markup": 4,
   "text": "### turn 5 [user]\nAnd tomorrow afternoon?\n\n"
  },
  {
   "id": 6,
   "parent": 0,
   "node_type": "turn",
   "title": "turn 6 assistant",
   "seq_ids": [
    6,
    7
   ],
   "positions": [
    28,
    29,
    30,
    31,
    32,
    33,
    34,
    35,
    36,
    37,
    38,
    39
   ],
   "tokens": [
    14711,
    2543,
    220,
    21,
    510,
    78191,
    933,
    41229,
    16986,
    596,
    18057,
    382
   ],
   "n_markup": 4,
   "text": "### turn 6 [assistant]\nChecking tomorrow's forecast.\n\n"
  },
  {
   "id": 7,
   "parent": 6,
   "node_type": "tool_call",
   "title": "turn 6 get_forecast",
   "seq_ids": [
    7
   ],
   "positions": [
    40,
    41,
    42,
    43,
    44,
    45,
    46,
    47,
    48,
    49,
    50,
    51,
    52,
    53,
    54,
    55,
    56,
    57,
    58,
    59,
    60,
    61,
    62,
    63,
    64,
    65,
    66,
    67,
    68,
    69,
    70,
    71,
    72,
    73,
    74,
    75,
    76
   ],
   "tokens": [
    6797,
    272,
    17,
    636,
    36663,
    3914,
    17289,
    9103,
    794,
    330,
    7229,
    362,
    899,
    258,
    498,
    330,
    1316,
    794,
    330,
    38501,
    7924,
    24546,
    1407,
    25,
    56096,
    220,
    868,
    25,
    410,
    25,
    28135,
    74649,
    11,
    220,
    843,
    34,
    382
   ],
   "n_markup": 12,
   "text": "call c2 get_forecast({\"city\": \"Port Avelin\", \"day\": \"tomorrow\"})\nresult: Tomorrow 15:00: partly cloudy, 32C.\n\n"
  },
  {
   "id": 8,
   "parent": 0,
   "node_type": "turn",
   "title": "turn 8 assistant",
   "seq_ids": [
    8
   ],
   "positions": [
    28,
    29,
    30,
    31,
    32,
    33,
    34,
    35,
    36,
    37,
    38,
    39,
    40,
    41,
    42,
    43,
    44,
    45,
    46,
    47,
    48
   ],
   "tokens": [
    14711,
    2543,
    220,
    23,
    510,
    78191,
    933,
    91273,
    520,
    220,
    868,
    25,
    410,
    1755,
    28135,
    74649,
    323,
    220,
    843,
    34,
    382
   ],
   "n_markup": 7,
   "text": "### turn 8 [assistant]\nTomorrow at 15:00 expect partly cloudy and 32C.\n\n"
  }
 ]
}