{
 "schema_version": 1,
 "domain": "json",
 "source": "product_catalog.json",
 "model": "Llama-3.2-1B-Instruct-Q4_K_M.gguf",
 "merge": {
  "min_leaf_tokens": 48,
  "max_nodes": 48,
  "nodes_before_merge": 39
 },
 "n_tokens": 230,
 "nodes": [
  {
   "id": 0,
   "parent": null,
   "node_type": "document",
   "title": "(document)",
   "seq_ids": [
    0,
    1,
    2,
    3,
    4,
    5,
    6,
    7,
    8,
    9
   ],
   "positions": [
    0,
    1,
    2,
    3,
    4,
    5,
    6,
    7,
    8,
    9,
    10,
    11,
    12,
    13,
    14,
    15,
    16,
    17,
    18,
    19,
    20,
    21,
    22,
    23,
    24,
    25,
    26,
    27
   ],
   "tokens": [
    128000,
    128006,
    9125,
    128007,
    271,
    16533,
    279,
    3488,
    1701,
    1193,
    279,
    4823,
    2246,
    13,
    22559,
    304,
    832,
    2875,
    11914,
    13,
    128009,
    128006,
    882,
    128007,
    271,
    5483,
    2246,
    1473
   ],
   "n_markup": 9,
   "text": "<|begin_of_text|><|start_header_id|>system<|end_header_id|>\n\nAnswer the question using only the JSON document. Answer in one short sentence.<|eot_id|><|start_header_id|>user<|end_header_id|>\n\nJSON document:\n\n"
  },
  {
   "id": 1,
   "parent": 0,
   "node_type": "object",
   "title": "pricing",
   "seq_ids": [
    1
   ],
   "positions": [
    28,
    29,
    30,
    31,
    32,
    33,
    34,
    35,
    36,
    37,
    38,
    39,
    40,
    41,
    42,
    43,
    44,
    45,
    46,
    47,
    48,
    49,
    50,
    51,
    52,
    53
   ],
   "tokens": [
    1,
    75470,
    794,
    341,
    1,
    16353,
    794,
    330,
    691,
    49,
    761,
    1,
    28459,
    72612,
    794,
    220,
    717,
    345,
    1,
    6692,
    794,
    220,
    14735,
    24,
    345,
    534
   ],
   "n_markup": 16,
   "text": "\"pricing\": {\n\"currency\": \"INR\",\n\"discount_pct\": 12,\n\"price\": 2499,\n}\n"
  },
  {
   "id": 2,
   "parent": 0,
   "node_type": "object",
   "title": "product",
   "seq_ids": [
    2,
    3
   ],
   "positions": [
    28,
    29,
    30,
    31,
    32,
    33,
    34,
    35,
    36,
    37,
    38,
    39,
    40,
    41,
    42,
    43,
    44,
    45,
    46,
    47,
    48,
    49,
    50,
    51,
    52,
    53,
    54,
    55,
    56,
    57,
    58,
    59,
    60
   ],
   "tokens": [
    1,
    3107,
    794,
    341,
    1,
    13781,
    794,
    330,
    2244,
    4590,
    761,
    32586,
    794,
    330,
    2244,
    4590,
    5944,
    52589,
    220,
    2636,
    1029,
    761,
    1,
    41029,
    794,
    330,
    74226,
    5364,
    3014,
    12,
    2636,
    761,
    534
   ],
   "n_markup": 16,
   "text": "\"product\": {\n\"brand\": \"Orbit\",\n\"name\": \"Orbit travel mug 500ml\",\n\"sku\": \"ORB-MUG-500\",\n}\n"
  },
  {
   "id": 3,
   "parent": 2,
   "node_type": "array",
   "title": "product.colours",
   "seq_ids": [
    3
   ],
   "positions": [
    61,
    62,
    63,
    64,
    65,
    66,
    67,
    68,
    69,
    70,
    71,
    72,
    73,
    74,
    75,
    76,
    77,
    78
   ],
   "tokens": [
    1,
    2119,
    2530,
    794,
    2330,
    1,
    15,
    794,
    330,
    62654,
    761,
    1,
    16,
    794,
    330,
    11708,
    761,
    933
   ],
   "n_markup": 12,
   "text": "\"colours\": [\n\"0\": \"steel\",\n\"1\": \"black\",\n]\n"
  },
  {
   "id": 4,
   "parent": 0,
   "node_type": "array",
   "title": "reviews",
   "seq_ids": [
    4,
    5,
    6,
    7
   ],
   "positions": [
    28,
    29,
    30,
    31,
    32
   ],
   "tokens": [
    1,
    40575,
    794,
    2330,
    933
   ],
   "n_markup": 4,
   "text": "\"reviews\": [\n]\n"
  },
  {
   "id": 5,
   "parent": 4,
   "node_type": "object",
   "title": "reviews[0]",
   "seq_ids": [
    5
   ],
   "positions": [
    33,
    34,
    35,
    36,
    37,
    38,
    39,
    40,
    41,
    42,
    43,
    44,
    45,
    46,
    47,
    48,
    49,
    50,
    51,
    52,
    53
   ],
   "tokens": [
    1,
    15,
    794,
    341,
    1,
    22696,
    794,
    220,
    20,
    345,
    67351,
    794,
    330,
    6746,
    7270,
    45181,
    4106,
    369,
    4207,
    10560,
    534
   ],
   "n_markup": 10,
   "text": "\"0\": {\n\"rating\": 5,\n\"text\": \"Keeps chai hot for hours.\",\n}\n"
  },
  {
   "id": 6,
   "parent": 4,
   "node_type": "object",
   "title": "reviews[1]",
   "seq_ids": [
    6
   ],
   "positions": [
    33,
    34,
    35,
    36,
    37,
    38,
    39,
    40,
    41,
    42,
    43,
    44,
    45,
    46,
    47,
    48,
    49,
    50,
    51,
    52,
    53
   ],
   "tokens": [
    1,
    16,
    794,
    341,
    1,
    22696,
    794,
    220,
    19,
    345,
    67351,
    794,
    330,
    43,
    307,
    37796,
    422,
    66472,
    927,
    10560,
    534
   ],
   "n_markup": 10,
   "text": "\"1\": {\n\"rating\": 4,\n\"text\": \"Lid leaks if tipped over.\",\n}\n"
  },
  {
   "id": 7,
   "parent": 4,
   "node_type": "object",
   "title": "reviews[2]",
   "seq_ids": [
    7
   ],
   "positions": [
    33,
    34,
    35,
    36,
    37,
    38,
    39,
    40,
    41,
    42,
    43,
    44,
    45,
    46,
    47,
    48,
    49,
    50,
    51,
    52,
    53
   ],
   "tokens": [
    1,
    17,
    794,
    341,
    1,
    22696,
    794,
    220,
    20,
    345,
    67351,
    794,
    330,
    37,
    1220,
    856,
    11008,
    16893,
    36460,
    10560,
    534
   ],
   "n_markup": 10,
   "text": "\"2\": {\n\"rating\": 5,\n\"text\": \"Fits my cycle bottle cage.\",\n}\n"
  },
  {
   "id": 8,
   "parent": 0,
   "node_type": "object",
   "title": "seller",
   "seq_ids": [
    8
   ],
   "positions": [
    28,
    29,
    30,
    31,
    32,
    33,
    34,
    35,
    36,
    37,
    38,
    39,
    40,
    41,
    42,
    43,
    44,
    45,
    46,
    47,
    48,
    49,
    50,
    51,
    52,
    53,
    54,
    55,
    56
   ],
   "tokens": [
    1,
    35199,
    794,
    341,
    1,
    2588,
    794,
    330,
    33,
    833,
    278,
    21585,
    761,
    32586,
    794,
    330,
    27588,
    15747,
    39402,
    761,
    1,
    22696,
    794,
    220,
    19,
    13,
    21,
    345,
    534
   ],
   "n_markup": 15,
   "text": "\"seller\": {\n\"location\": \"Bengaluru\",\n\"name\": \"Harbour Stores\",\n\"rating\": 4.6,\n}\n"
  },
  {
   "id": 9,
   "parent": 0,
   "node_type": "object",
   "title": "shipping",
   "seq_ids": [
    9
   ],
   "positions": [
    28,
    29,
    30,
    31,
    32,
    33,
    34,
    35,
    36,
    37,
    38,
    39,
    40,
    41,
    42,
    43,
    44,
    45,
    46,
    47,
    48,
    49,
    50,
    51,
    52,
    53,
    54,
    55
   ],
   "tokens": [
    1,
    27606,
    794,
    341,
    1,
    67971,
    1291,
    794,
    330,
    75441,
    10397,
    1911,
    761,
    1,
    33490,
    29453,
    794,
    220,
    18,
    345,
    1,
    10816,
    78415,
    794,
    220,
    5500,
    345,
    534
   ],
   "n_markup": 16,
   "text": "\"shipping\": {\n\"courier\": \"orbit-express\",\n\"delivery_days\": 3,\n\"free_above\": 999,\n}\n"
  }
 ]
}