{
 "schema_version": 1,
 "domain": "chatlogs",
 "source": "repo_issue.json",
 "model": "Llama-3.2-1B-Instruct-Q4_K_M.gguf",
 "merge": {
  "min_leaf_tokens": 48,
  "max_nodes": 48,
  "nodes_before_merge": 17
 },
 "n_tokens": 207,
 "nodes": [
  {
   "id": 0,
   "parent": null,
   "node_type": "document",
   "title": "(document)",
   "seq_ids": [
    0,
    1,
    2,
    3,
    4,
    5,
    6,
    7,
    8
   ],
   "positions": [
    0,
    1,
    2,
    3,
    4,
    5,
    6,
    7,
    8,
    9,
    10,
    11,
    12,
    13,
    14,
    15,
    16,
    17,
    18,
    19,
    20,
    21,
    22,
    23,
    24,
    25,
    26,
    27
   ],
   "tokens": [
    128000,
    128006,
    9125,
    128007,
    271,
    16533,
    279,
    3488,
    1701,
    1193,
    279,
    10652,
    1515,
    13,
    22559,
    304,
    832,
    2875,
    11914,
    13,
    128009,
    128006,
    882,
    128007,
    271,
    61413,
    1515,
    1473
   ],
   "n_markup": 9,
   "text": "<|begin_of_text|><|start_header_id|>system<|end_header_id|>\n\nAnswer the question using only the conversation log. Answer in one short sentence.<|eot_id|><|start_header_id|>user<|end_header_id|>\n\nConversation log:\n\n"
  },
  {
   "id": 1,
   "parent": 0,
   "node_type": "turn",
   "title": "turn 1 user",
   "seq_ids": [
    1
   ],
   "positions": [
    28,
    29,
    30,
    31,
    32,
    33,
    34,
    35,
    36,
    37,
    38,
    39,
    40,
    41,
    42,
    43,
    44,
    45,
    46,
    47,
    48
   ],
   "tokens": [
    14711,
    2543,
    220,
    16,
    510,
    882,
    933,
    791,
    917,
    37237,
    994,
    279,
    2242,
    1052,
    374,
    4384,
    13,
    26292,
    220,
    17574,
    382
   ],
   "n_markup": 5,
   "text": "### turn 1 [user]\nThe app crashes when the config file is empty. Issue 412.\n\n"
  },
  {
   "id": 2,
   "parent": 0,
   "node_type": "turn",
   "title": "turn 2 assistant",
   "seq_ids": [
    2,
    3
   ],
   "positions": [
    28,
    29,
    30,
    31,
    32,
    33,
    34,
    35,
    36,
    37,
    38,
    39,
    40,
    41
   ],
   "tokens": [
    14711,
    2543,
    220,
    17,
    510,
    78191,
    933,
    37168,
    287,
    709,
    4360,
    220,
    17574,
    382
   ],
   "n_markup": 5,
   "text": "### turn 2 [assistant]\nPulling up issue 412.\n\n"
  },
  {
   "id": 3,
   "parent": 2,
   "node_type": "tool_call",
   "title": "turn 2 get_issue",
   "seq_ids": [
    3
   ],
   "positions": [
    42,
    43,
    44,
    45,
    46,
    47,
    48,
    49,
    50,
    51,
    52,
    53,
    54,
    55,
    56,
    57,
    58,
    59,
    60,
    61,
    62,
    63,
    64,
    65,
    66,
    67,
    68,
    69,
    70,
    71,
    72,
    73,
    74,
    75,
    76,
    77,
    78,
    79,
    80,
    81,
    82,
    83,
    84,
    85
   ],
   "tokens": [
    6797,
    272,
    16,
    636,
    54440,
    17289,
    307,
    794,
    220,
    17574,
    3602,
    1407,
    25,
    26292,
    220,
    17574,
    1825,
    11,
    9993,
    2176,
    1008,
    488,
    64,
    11,
    2316,
    25,
    51435,
    389,
    4384,
    2242,
    1052,
    13,
    55025,
    4360,
    220,
    18058,
    574,
    264,
    27437,
    86205,
    11,
    2736,
    8036,
    382
   ],
   "n_markup": 8,
   "text": "call c1 get_issue({\"id\": 412})\nresult: Issue 412 open, assignee aditya, title: Crash on empty config file. Older issue 408 was a docs typo, already closed.\n\n"
  },
  {
   "id": 4,
   "parent": 0,
   "node_type": "turn",
   "title": "turn 4 assistant",
   "seq_ids": [
    4
   ],
   "positions": [
    28,
    29,
    30,
    31,
    32,
    33,
    34,
    35,
    36,
    37,
    38,
    39,
    40,
    41,
    42,
    43,
    44,
    45,
    46
   ],
   "tokens": [
    14711,
    2543,
    220,
    19,
    510,
    78191,
    933,
    43106,
    220,
    17574,
    374,
    1825,
    323,
    12893,
    311,
    1008,
    488,
    64,
    382
   ],
   "n_markup": 5,
   "text": "### turn 4 [assistant]\nIssue 412 is open and assigned to aditya.\n\n"
  },
  {
   "id": 5,
   "parent": 0,
   "node_type": "turn",
   "title": "turn 5 user",
   "seq_ids": [
    5
   ],
   "positions": [
    28,
    29,
    30,
    31,
    32,
    33,
    34,
    35,
    36,
    37,
    38,
    39,
    40,
    41,
    42,
    43,
    44
   ],
   "tokens": [
    14711,
    2543,
    220,
    20,
    510,
    882,
    933,
    5618,
    4068,
    430,
    358,
    649,
    23645,
    433,
    389,
    14677,
    382
   ],
   "n_markup": 4,
   "text": "### turn 5 [user]\nPlease comment that I can reproduce it on Linux.\n\n"
  },
  {
   "id": 6,
   "parent": 0,
   "node_type": "turn",
   "title": "turn 6 assistant",
   "seq_ids": [
    6,
    7
   ],
   "positions": [
    28,
    29,
    30,
    31,
    32,
    33,
    34,
    35,
    36,
    37,
    38
   ],
   "tokens": [
    14711,
    2543,
    220,
    21,
    510,
    78191,
    933,
    82752,
    701,
    4068,
    382
   ],
   "n_markup": 4,
   "text": "### turn 6 [assistant]\nPosting your comment.\n\n"
  },
  {
   "id": 7,
   "parent": 6,
   "node_type": "tool_call",
   "title": "turn 6 post_comment",
   "seq_ids": [
    7
   ],
   "positions": [
    39,
    40,
    41,
    42,
    43,
    44,
    45,
    46,
    47,
    48,
    49,
    50,
    51,
    52,
    53,
    54,
    55,
    56,
    57,
    58,
    59,
    60,
    61,
    62,
    63,
    64,
    65,
    66,
    67,
    68,
    69,
    70,
    71
   ],
   "tokens": [
    6797,
    272,
    17,
    1772,
    18104,
    17289,
    307,
    794,
    220,
    17574,
    11,
    330,
    1342,
    794,
    330,
    697,
    8723,
    2041,
    389,
    14677,
    1210,
    3602,
    1407,
    25,
    12535,
    8621,
    439,
    4068,
    887,
    220,
    24606,
    22,
    382
   ],
   "n_markup": 9,
   "text": "call c2 post_comment({\"id\": 412, \"text\": \"Reproduced on Linux.\"})\nresult: Comment posted as comment id 9917.\n\n"
  },
  {
   "id": 8,
   "parent": 0,
   "node_type": "turn",
   "title": "turn 8 assistant",
   "seq_ids": [
    8
   ],
   "positions": [
    28,
    29,
    30,
    31,
    32,
    33,
    34,
    35,
    36,
    37,
    38,
    39,
    40,
    41,
    42,
    43,
    44,
    45,
    46,
    47
   ],
   "tokens": [
    14711,
    2543,
    220,
    23,
    510,
    78191,
    933,
    17911,
    11,
    701,
    4068,
    374,
    8621,
    439,
    4068,
    887,
    220,
    24606,
    22,
    382
   ],
   "n_markup": 5,
   "text": "### turn 8 [assistant]\nDone, your comment is posted as comment id 9917.\n\n"
  }
 ]
}