{
 "schema_version": 1,
 "domain": "json",
 "source": "flight_search.json",
 "model": "Llama-3.2-1B-Instruct-Q4_K_M.gguf",
 "merge": {
  "min_leaf_tokens": 48,
  "max_nodes": 48,
  "nodes_before_merge": 39
 },
 "n_tokens": 251,
 "nodes": [
  {
   "id": 0,
   "parent": null,
   "node_type": "document",
   "title": "(document)",
   "seq_ids": [
    0,
    1,
    2,
    3,
    4,
    5,
    6,
    7,
    8
   ],
   "positions": [
    0,
    1,
    2,
    3,
    4,
    5,
    6,
    7,
    8,
    9,
    10,
    11,
    12,
    13,
    14,
    15,
    16,
    17,
    18,
    19,
    20,
    21,
    22,
    23,
    24,
    25,
    26,
    27
   ],
   "tokens": [
    128000,
    128006,
    9125,
    128007,
    271,
    16533,
    279,
    3488,
    1701,
    1193,
    279,
    4823,
    2246,
    13,
    22559,
    304,
    832,
    2875,
    11914,
    13,
    128009,
    128006,
    882,
    128007,
    271,
    5483,
    2246,
    1473
   ],
   "n_markup": 9,
   "text": "<|begin_of_text|><|start_header_id|>system<|end_header_id|>\n\nAnswer the question using only the JSON document. Answer in one short sentence.<|eot_id|><|start_header_id|>user<|end_header_id|>\n\nJSON document:\n\n"
  },
  {
   "id": 1,
   "parent": 0,
   "node_type": "array",
   "title": "fares",
   "seq_ids": [
    1,
    2,
    3,
    4
   ],
   "positions": [
    28,
    29,
    30,
    31,
    32,
    33
   ],
   "tokens": [
    1,
    3716,
    417,
    794,
    2330,
    933
   ],
   "n_markup": 4,
   "text": "\"fares\": [\n]\n"
  },
  {
   "id": 2,
   "parent": 1,
   "node_type": "object",
   "title": "fares[0]",
   "seq_ids": [
    2
   ],
   "positions": [
    34,
    35,
    36,
    37,
    38,
    39,
    40,
    41,
    42,
    43,
    44,
    45,
    46,
    47,
    48,
    49,
    50,
    51,
    52,
    53,
    54
   ],
   "tokens": [
    1,
    15,
    794,
    341,
    98046,
    9068,
    794,
    330,
    68,
    71171,
    761,
    1,
    6692,
    1265,
    81,
    794,
    220,
    24313,
    15,
    345,
    534
   ],
   "n_markup": 11,
   "text": "\"0\": {\n\"cabin\": \"economy\",\n\"price_inr\": 6840,\n}\n"
  },
  {
   "id": 3,
   "parent": 1,
   "node_type": "object",
   "title": "fares[1]",
   "seq_ids": [
    3
   ],
   "positions": [
    34,
    35,
    36,
    37,
    38,
    39,
    40,
    41,
    42,
    43,
    44,
    45,
    46,
    47,
    48,
    49,
    50,
    51,
    52,
    53
   ],
   "tokens": [
    1,
    16,
    794,
    341,
    98046,
    9068,
    794,
    330,
    12287,
    761,
    1,
    6692,
    1265,
    81,
    794,
    220,
    22536,
    15,
    345,
    534
   ],
   "n_markup": 11,
   "text": "\"1\": {\n\"cabin\": \"flex\",\n\"price_inr\": 9210,\n}\n"
  },
  {
   "id": 4,
   "parent": 1,
   "node_type": "object",
   "title": "fares[2]",
   "seq_ids": [
    4
   ],
   "positions": [
    34,
    35,
    36,
    37,
    38,
    39,
    40,
    41,
    42,
    43,
    44,
    45,
    46,
    47,
    48,
    49,
    50,
    51,
    52,
    53
   ],
   "tokens": [
    1,
    17,
    794,
    341,
    98046,
    9068,
    794,
    330,
    27243,
    761,
    1,
    6692,
    1265,
    81,
    794,
    220,
    10513,
    410,
    345,
    534
   ],
   "n_markup": 11,
   "text": "\"2\": {\n\"cabin\": \"business\",\n\"price_inr\": 16400,\n}\n"
  },
  {
   "id": 5,
   "parent": 0,
   "node_type": "object",
   "title": "inbound",
   "seq_ids": [
    5
   ],
   "positions": [
    28,
    29,
    30,
    31,
    32,
    33,
    34,
    35,
    36,
    37,
    38,
    39,
    40,
    41,
    42,
    43,
    44,
    45,
    46,
    47,
    48,
    49,
    50,
    51,
    52,
    53,
    54,
    55,
    56,
    57,
    58,
    59,
    60,
    61,
    62,
    63,
    64,
    65,
    66,
    67,
    68,
    69,
    70
   ],
   "tokens": [
    55501,
    11130,
    794,
    341,
    1,
    1138,
    535,
    794,
    330,
    1691,
    25,
    1272,
    761,
    1,
    33148,
    794,
    330,
    777,
    25,
    2304,
    761,
    1,
    39490,
    794,
    330,
    61255,
    12,
    11584,
    761,
    1,
    1527,
    794,
    330,
    39432,
    761,
    1,
    998,
    794,
    330,
    9574,
    49,
    761,
    534
   ],
   "n_markup": 25,
   "text": "\"inbound\": {\n\"arrive\": \"21:40\",\n\"depart\": \"19:05\",\n\"flight\": \"OX-214\",\n\"from\": \"DEL\",\n\"to\": \"BLR\",\n}\n"
  },
  {
   "id": 6,
   "parent": 0,
   "node_type": "object",
   "title": "outbound",
   "seq_ids": [
    6
   ],
   "positions": [
    28,
    29,
    30,
    31,
    32,
    33,
    34,
    35,
    36,
    37,
    38,
    39,
    40,
    41,
    42,
    43,
    44,
    45,
    46,
    47,
    48,
    49,
    50,
    51,
    52,
    53,
    54,
    55,
    56,
    57,
    58,
    59,
    60,
    61,
    62,
    63,
    64,
    65,
    66,
    67,
    68,
    69,
    70,
    71
   ],
   "tokens": [
    1,
    412,
    11130,
    794,
    341,
    1,
    1138,
    535,
    794,
    330,
    2545,
    25,
    868,
    761,
    1,
    33148,
    794,
    330,
    2705,
    25,
    1272,
    761,
    1,
    39490,
    794,
    330,
    61255,
    12,
    12652,
    761,
    1,
    1527,
    794,
    330,
    9574,
    49,
    761,
    1,
    998,
    794,
    330,
    39432,
    761,
    534
   ],
   "n_markup": 26,
   "text": "\"outbound\": {\n\"arrive\": \"09:15\",\n\"depart\": \"06:40\",\n\"flight\": \"OX-209\",\n\"from\": \"BLR\",\n\"to\": \"DEL\",\n}\n"
  },
  {
   "id": 7,
   "parent": 0,
   "node_type": "object",
   "title": "policies",
   "seq_ids": [
    7
   ],
   "positions": [
    28,
    29,
    30,
    31,
    32,
    33,
    34,
    35,
    36,
    37,
    38,
    39,
    40,
    41,
    42,
    43,
    44,
    45,
    46,
    47,
    48,
    49,
    50,
    51,
    52,
    53,
    54,
    55,
    56,
    57,
    58,
    59,
    60,
    61,
    62,
    63,
    64,
    65,
    66,
    67
   ],
   "tokens": [
    1,
    79,
    43138,
    794,
    341,
    1,
    21946,
    15292,
    794,
    330,
    868,
    7501,
    1817,
    3502,
    5343,
    761,
    1,
    2727,
    1147,
    794,
    330,
    35778,
    43402,
    1193,
    761,
    1,
    69583,
    794,
    330,
    38520,
    21639,
    709,
    311,
    220,
    1187,
    71,
    1603,
    25959,
    761,
    534
   ],
   "n_markup": 17,
   "text": "\"policies\": {\n\"baggage\": \"15kg check-in included\",\n\"meals\": \"paid snacks only\",\n\"refund\": \"partial refund up to 24h before departure\",\n}\n"
  },
  {
   "id": 8,
   "parent": 0,
   "node_type": "object",
   "title": "query",
   "seq_ids": [
    8
   ],
   "positions": [
    28,
    29,
    30,
    31,
    32,
    33,
    34,
    35,
    36,
    37,
    38,
    39,
    40,
    41,
    42,
    43,
    44,
    45,
    46,
    47,
    48,
    49,
    50,
    51,
    52,
    53,
    54,
    55,
    56
   ],
   "tokens": [
    1,
    1663,
    794,
    341,
    1,
    1045,
    794,
    330,
    2366,
    21,
    12,
    806,
    12,
    2437,
    761,
    1,
    6519,
    15232,
    794,
    220,
    16,
    345,
    1,
    34081,
    794,
    330,
    1067,
    761,
    534
   ],
   "n_markup": 16,
   "text": "\"query\": {\n\"date\": \"2026-11-02\",\n\"passengers\": 1,\n\"trip\": \"round\",\n}\n"
  }
 ]
}