{
 "schema_version": 1,
 "domain": "chatlogs",
 "source": "shopping_return.json",
 "model": "Llama-3.2-1B-Instruct-Q4_K_M.gguf",
 "merge": {
  "min_leaf_tokens": 48,
  "max_nodes": 48,
  "nodes_before_merge": 17
 },
 "n_tokens": 207,
 "nodes": [
  {
   "id": 0,
   "parent": null,
   "node_type": "document",
   "title": "(document)",
   "seq_ids": [
    0,
    1,
    2,
    3,
    4,
    5,
    6,
    7,
    8
   ],
   "positions": [
    0,
    1,
    2,
    3,
    4,
    5,
    6,
    7,
    8,
    9,
    10,
    11,
    12,
    13,
    14,
    15,
    16,
    17,
    18,
    19,
    20,
    21,
    22,
    23,
    24,
    25,
    26,
    27
   ],
   "tokens": [
    128000,
    128006,
    9125,
    128007,
    271,
    16533,
    279,
    3488,
    1701,
    1193,
    279,
    10652,
    1515,
    13,
    22559,
    304,
    832,
    2875,
    11914,
    13,
    128009,
    128006,
    882,
    128007,
    271,
    61413,
    1515,
    1473
   ],
   "n_markup": 9,
   "text": "<|begin_of_text|><|start_header_id|>system<|end_header_id|>\n\nAnswer the question using only the conversation log. Answer in one short sentence.<|eot_id|><|start_header_id|>user<|end_header_id|>\n\nConversation log:\n\n"
  },
  {
   "id": 1,
   "parent": 0,
   "node_type": "turn",
   "title": "turn 1 user",
   "seq_ids": [
    1
   ],
   "positions": [
    28,
    29,
    30,
    31,
    32,
    33,
    34,
    35,
    36,
    37,
    38,
    39,
    40,
    41,
    42,
    43,
    44,
    45,
    46,
    47,
    48
   ],
   "tokens": [
    14711,
    2543,
    220,
    16,
    510,
    882,
    933,
    40,
    1390,
    311,
    471,
    856,
    85557,
    5944,
    52589,
    11,
    2015,
    220,
    24876,
    15,
    382
   ],
   "n_markup": 5,
   "text": "### turn 1 [user]\nI want to return my Orbit travel mug, order 7710.\n\n"
  },
  {
   "id": 2,
   "parent": 0,
   "node_type": "turn",
   "title": "turn 2 assistant",
   "seq_ids": [
    2,
    3
   ],
   "positions": [
    28,
    29,
    30,
    31,
    32,
    33,
    34,
    35,
    36,
    37,
    38,
    39,
    40,
    41
   ],
   "tokens": [
    14711,
    2543,
    220,
    17,
    510,
    78191,
    933,
    23274,
    709,
    2015,
    220,
    24876,
    15,
    382
   ],
   "n_markup": 5,
   "text": "### turn 2 [assistant]\nLooking up order 7710.\n\n"
  },
  {
   "id": 3,
   "parent": 2,
   "node_type": "tool_call",
   "title": "turn 2 get_order",
   "seq_ids": [
    3
   ],
   "positions": [
    42,
    43,
    44,
    45,
    46,
    47,
    48,
    49,
    50,
    51,
    52,
    53,
    54,
    55,
    56,
    57,
    58,
    59,
    60,
    61,
    62,
    63,
    64,
    65,
    66,
    67,
    68,
    69,
    70,
    71,
    72,
    73,
    74,
    75,
    76,
    77,
    78,
    79,
    80,
    81,
    82,
    83,
    84,
    85
   ],
   "tokens": [
    6797,
    272,
    16,
    636,
    8028,
    17289,
    1382,
    794,
    220,
    24876,
    15,
    3602,
    1407,
    25,
    7365,
    220,
    24876,
    15,
    25,
    85557,
    5944,
    52589,
    220,
    2636,
    1029,
    11,
    2006,
    49,
    220,
    14735,
    24,
    11,
    28358,
    555,
    27605,
    10397,
    1911,
    11,
    12886,
    220,
    18,
    2919,
    4227,
    382
   ],
   "n_markup": 10,
   "text": "call c1 get_order({\"order\": 7710})\nresult: Order 7710: Orbit travel mug 500ml, INR 2499, shipped by orbit-express, delivered 3 days ago.\n\n"
  },
  {
   "id": 4,
   "parent": 0,
   "node_type": "turn",
   "title": "turn 4 assistant",
   "seq_ids": [
    4
   ],
   "positions": [
    28,
    29,
    30,
    31,
    32,
    33,
    34,
    35,
    36,
    37,
    38,
    39,
    40,
    41
   ],
   "tokens": [
    14711,
    2543,
    220,
    19,
    510,
    78191,
    933,
    6788,
    433,
    13,
    27857,
    369,
    471,
    1980
   ],
   "n_markup": 4,
   "text": "### turn 4 [assistant]\nFound it. Reason for return?\n\n"
  },
  {
   "id": 5,
   "parent": 0,
   "node_type": "turn",
   "title": "turn 5 user",
   "seq_ids": [
    5
   ],
   "positions": [
    28,
    29,
    30,
    31,
    32,
    33,
    34,
    35,
    36,
    37,
    38
   ],
   "tokens": [
    14711,
    2543,
    220,
    20,
    510,
    882,
    933,
    791,
    27431,
    37796,
    382
   ],
   "n_markup": 4,
   "text": "### turn 5 [user]\nThe lid leaks.\n\n"
  },
  {
   "id": 6,
   "parent": 0,
   "node_type": "turn",
   "title": "turn 6 assistant",
   "seq_ids": [
    6,
    7
   ],
   "positions": [
    28,
    29,
    30,
    31,
    32,
    33,
    34,
    35,
    36,
    37,
    38,
    39
   ],
   "tokens": [
    14711,
    2543,
    220,
    21,
    510,
    78191,
    933,
    37,
    8138,
    279,
    471,
    382
   ],
   "n_markup": 4,
   "text": "### turn 6 [assistant]\nFiling the return.\n\n"
  },
  {
   "id": 7,
   "parent": 6,
   "node_type": "tool_call",
   "title": "turn 6 start_return",
   "seq_ids": [
    7
   ],
   "positions": [
    40,
    41,
    42,
    43,
    44,
    45,
    46,
    47,
    48,
    49,
    50,
    51,
    52,
    53,
    54,
    55,
    56,
    57,
    58,
    59,
    60,
    61,
    62,
    63,
    64,
    65,
    66,
    67,
    68,
    69,
    70,
    71,
    72,
    73,
    74,
    75,
    76,
    77,
    78
   ],
   "tokens": [
    6797,
    272,
    17,
    1212,
    12794,
    17289,
    1382,
    794,
    220,
    24876,
    15,
    11,
    330,
    20489,
    794,
    330,
    62306,
    37796,
    24546,
    1407,
    25,
    3494,
    432,
    12,
    21860,
    11928,
    13,
    8718,
    1263,
    315,
    2006,
    49,
    220,
    14735,
    24,
    311,
    2592,
    2759,
    382
   ],
   "n_markup": 10,
   "text": "call c2 start_return({\"order\": 7710, \"reason\": \"lid leaks\"})\nresult: Return R-551 accepted. Refund of INR 2499 to source account.\n\n"
  },
  {
   "id": 8,
   "parent": 0,
   "node_type": "turn",
   "title": "turn 8 assistant",
   "seq_ids": [
    8
   ],
   "positions": [
    28,
    29,
    30,
    31,
    32,
    33,
    34,
    35,
    36,
    37,
    38,
    39,
    40,
    41,
    42,
    43,
    44,
    45,
    46,
    47,
    48,
    49,
    50,
    51
   ],
   "tokens": [
    14711,
    2543,
    220,
    23,
    510,
    78191,
    933,
    5715,
    432,
    12,
    21860,
    11928,
    11,
    21639,
    315,
    2006,
    49,
    220,
    14735,
    24,
    389,
    1202,
    1648,
    382
   ],
   "n_markup": 6,
   "text": "### turn 8 [assistant]\nReturn R-551 accepted, refund of INR 2499 on its way.\n\n"
  }
 ]
}